{
  "bits": 4,
  "codebook": {
    "values": [
      -1.0,
      -0.6961928009986877,
      -0.5250730514526367,
      -0.39491748809814453,
      -0.28444138169288635,
      -0.18477343022823334,
      -0.09105003625154495,
      0.0,
      0.07958029955625534,
      0.16093020141124725,
      0.24611230194568634,
      0.33791524171829224,
      0.44070982933044434,
      0.5626170039176941,
      0.7229568362236023,
      1.0
    ]
  },
  "encoding": "bitsandbytes_normalfloat4",
  "family": "codebook",
  "name": "nf4",
  "overflow": "saturate",
  "rounding": "rne",
  "scaling": {
    "granularity": "per_tensor",
    "mode": "required_mapping"
  },
  "schema_version": "1.0.0",
  "signed": true,
  "underflow": "not_applicable",
  "zero": "code_0111"
}
