{
  "bits": 6,
  "encoding": "zero_then_signed_log2",
  "family": "logarithmic",
  "logarithmic": {
    "fractional_bits": 2,
    "integer_bits": 2,
    "linear_near_zero": false
  },
  "name": "log6",
  "overflow": "saturate",
  "rounding": "rne",
  "scaling": {
    "granularity": "none",
    "mode": "none"
  },
  "schema_version": "1.0.0",
  "signed": true,
  "underflow": "not_applicable",
  "zero": "code_zero"
}
