{
  "schema_version": "1.0.0",
  "name": "posit8_es1_quire64_f28_accumulator",
  "family": "fixed_point",
  "bits": 64,
  "signed": true,
  "encoding": "twos_complement_fixed",
  "rounding": "rne",
  "overflow": "saturate",
  "underflow": "not_applicable",
  "zero": "code_0",
  "numeric": {"integer_bits": 35, "fractional_bits": 28, "zero_point": 0},
  "scaling": {"mode": "none", "granularity": "none"},
  "notes": "Phase 3 candidate for the reproduced MobileNetV3 posit8 hard-swish failure at code 1. Four additional fractional bits retain a 64-bit accumulator; actual MAC headroom and non-MAC precision must be checked per graph. Not a NaR-capable standard quire or blanket family acceptance."
}
