{
  "schema_version": "1.0.0", "name": "posit8_es1_quire64_accumulator", "family": "fixed_point",
  "bits": 64, "signed": true, "encoding": "twos_complement_fixed", "rounding": "rne",
  "overflow": "saturate", "underflow": "not_applicable", "zero": "code_0",
  "numeric": {"integer_bits": 39, "fractional_bits": 24, "zero_point": 0},
  "scaling": {"mode": "none", "granularity": "none"},
  "notes": "Explicit 64-bit fixed accumulator for unscaled posit8_es1 products, whose least product quantum is 2^-24. Not a frozen family-wide baseline or a NaR-capable standard quire."
}
